{"job_id":"0782bb0e-52dc-46d4-9562-d40bfaa9fb11","job_type":"mapping_rebuild","status":"queued","request_id":"req-rebuild-001","idempotency_key":"mapping-rebuild-site-a-v2","run_id":"4d073857-2966-4acc-a65f-a77f483bbbec","mapping_id":"sensor-protocol-mapping","mapping_version":"2.0.0","mapping_sha256":"1111111111111111111111111111111111111111111111111111111111111111","source_uri":"gen_data/site-a/cell-01/sensor.log","source_identity":null,"replay_scope":"full_source","activate_on_success":true,"progress":{},"checkpoint":null,"result":null,"error":null,"retry_count":0,"cancel_requested":false,"created_by":"system-operator-1","created_at":"2026-09-01T00:00:00Z","started_at":null,"heartbeat_at":null,"completed_at":null}
