{"$schema":"https://ontology-dashboard.local/schemas/system-pipeline-job.schema.json","job_id":"0782bb0e-52dc-46d4-9562-d40bfaa9fb11","job_type":"mapping_rebuild","status":"succeeded","request_id":"req-rebuild-001","idempotency_key":"mapping-rebuild-site-a-v2","run_id":"4d073857-2966-4acc-a65f-a77f483bbbec","mapping_id":"sensor-protocol-mapping","mapping_version":"2.0.0","mapping_sha256":"1111111111111111111111111111111111111111111111111111111111111111","source_uri":"gen_data/site-a/cell-01/sensor.log","source_identity":"source-site-a-cell-01","replay_scope":"full_source","activate_on_success":true,"progress":{"processed_records":1200,"total_records":1200},"checkpoint":{"last_committed_offset":98304},"result":{"published_datasets":["gen-data-site-a-cell-01/window-20260901T000000Z-map-11111111"]},"error":null,"retry_count":0,"cancel_requested":false,"created_by":"system-operator-1","created_at":"2026-09-01T00:00:00Z","started_at":"2026-09-01T00:00:01Z","heartbeat_at":"2026-09-01T00:01:00Z","completed_at":"2026-09-01T00:01:01Z"}
